output file:
processed_classes-torchgeonormalize24.json
function:
normalize
Error Cases:

Pass or Failed: 1

Related Failed Test Cases:
set()

All Test Cases On Generated code:
============================= test session starts ==============================
platform linux -- Python 3.11.10, pytest-8.3.4, pluggy-1.5.0 -- /local/data0/moved_data/publishablew/torchgeo/torchgeo/venv/bin/python3
cachedir: .pytest_cache
rootdir: /local/data0/moved_data/publishablew/torchgeo/torchgeo
configfile: pyproject.toml
plugins: hydra-core-1.3.2
collecting ... collected 7 items

../../../../../../local/data0/moved_data/publishablew/torchgeo/torchgeo/tests/models/test_rcf.py::TestRCF::test_in_channels PASSED [ 14%]
../../../../../../local/data0/moved_data/publishablew/torchgeo/torchgeo/tests/models/test_rcf.py::TestRCF::test_num_features PASSED [ 28%]
../../../../../../local/data0/moved_data/publishablew/torchgeo/torchgeo/tests/models/test_rcf.py::TestRCF::test_untrainable PASSED [ 42%]
../../../../../../local/data0/moved_data/publishablew/torchgeo/torchgeo/tests/models/test_rcf.py::TestRCF::test_biases PASSED [ 57%]
../../../../../../local/data0/moved_data/publishablew/torchgeo/torchgeo/tests/models/test_rcf.py::TestRCF::test_seed PASSED [ 71%]
../../../../../../local/data0/moved_data/publishablew/torchgeo/torchgeo/tests/models/test_rcf.py::TestRCF::test_empirical FAILED [ 85%]
../../../../../../local/data0/moved_data/publishablew/torchgeo/torchgeo/tests/models/test_rcf.py::TestRCF::test_empirical_no_dataset PASSED [100%]

=================================== FAILURES ===================================
____________________________ TestRCF.test_empirical ____________________________

self = <tests.models.test_rcf.TestRCF object at 0x753f9872f690>

    def test_empirical(self) -> None:
        root = os.path.join('tests', 'data', 'eurosat')
>       ds = EuroSAT(root=root, bands=EuroSAT.rgb_bands, split='train')

/local/data0/moved_data/publishablew/torchgeo/torchgeo/tests/models/test_rcf.py:49: 
_ _ _ _ _ _ _ _ _ _ _ _ _ _ _ _ _ _ _ _ _ _ _ _ _ _ _ _ _ _ _ _ _ _ _ _ _ _ _ _ 
/local/data0/moved_data/publishablew/torchgeo/torchgeo/torchgeo/datasets/eurosat.py:141: in __init__
    self._verify()
_ _ _ _ _ _ _ _ _ _ _ _ _ _ _ _ _ _ _ _ _ _ _ _ _ _ _ _ _ _ _ _ _ _ _ _ _ _ _ _ 

self = <[AttributeError("'EuroSAT' object has no attribute 'imgs'") raised in repr()] EuroSAT object at 0x753f9874b190>

    def _verify(self) -> None:
        """Verify the integrity of the dataset."""
        # Check if the files already exist
        filepath = os.path.join(self.root, self.base_dir)
        if os.path.exists(filepath):
            return
    
        # Check if zip file already exists (if so then extract)
        if self._check_integrity():
            self._extract()
            return
    
        # Check if the user requested to download the dataset
        if not self.download:
>           raise DatasetNotFoundError(self)
E           torchgeo.datasets.errors.DatasetNotFoundError: Dataset not found in `root='tests/data/eurosat'` and `download=False`, either specify a different `root` or use `download=True` to automatically download the dataset.

/local/data0/moved_data/publishablew/torchgeo/torchgeo/torchgeo/datasets/eurosat.py:201: DatasetNotFoundError
=========================== short test summary info ============================
FAILED ../../../../../../local/data0/moved_data/publishablew/torchgeo/torchgeo/tests/models/test_rcf.py::TestRCF::test_empirical
========================= 1 failed, 6 passed in 1.38s ==========================


Final Test Result:
============================= test session starts ==============================
platform linux -- Python 3.11.10, pytest-8.3.4, pluggy-1.5.0 -- /local/data0/moved_data/publishablew/torchgeo/torchgeo/venv/bin/python3
cachedir: .pytest_cache
rootdir: /local/data0/moved_data/publishablew/torchgeo/torchgeo
configfile: pyproject.toml
plugins: hydra-core-1.3.2
collecting ... collected 7 items

../../../../../../local/data0/moved_data/publishablew/torchgeo/torchgeo/tests/models/test_rcf.py::TestRCF::test_in_channels PASSED [ 14%]
../../../../../../local/data0/moved_data/publishablew/torchgeo/torchgeo/tests/models/test_rcf.py::TestRCF::test_num_features PASSED [ 28%]
../../../../../../local/data0/moved_data/publishablew/torchgeo/torchgeo/tests/models/test_rcf.py::TestRCF::test_untrainable PASSED [ 42%]
../../../../../../local/data0/moved_data/publishablew/torchgeo/torchgeo/tests/models/test_rcf.py::TestRCF::test_biases PASSED [ 57%]
../../../../../../local/data0/moved_data/publishablew/torchgeo/torchgeo/tests/models/test_rcf.py::TestRCF::test_seed PASSED [ 71%]
../../../../../../local/data0/moved_data/publishablew/torchgeo/torchgeo/tests/models/test_rcf.py::TestRCF::test_empirical FAILED [ 85%]
../../../../../../local/data0/moved_data/publishablew/torchgeo/torchgeo/tests/models/test_rcf.py::TestRCF::test_empirical_no_dataset PASSED [100%]

=================================== FAILURES ===================================
____________________________ TestRCF.test_empirical ____________________________

self = <tests.models.test_rcf.TestRCF object at 0x772ef4d39010>

    def test_empirical(self) -> None:
        root = os.path.join('tests', 'data', 'eurosat')
>       ds = EuroSAT(root=root, bands=EuroSAT.rgb_bands, split='train')

/local/data0/moved_data/publishablew/torchgeo/torchgeo/tests/models/test_rcf.py:49: 
_ _ _ _ _ _ _ _ _ _ _ _ _ _ _ _ _ _ _ _ _ _ _ _ _ _ _ _ _ _ _ _ _ _ _ _ _ _ _ _ 
/local/data0/moved_data/publishablew/torchgeo/torchgeo/torchgeo/datasets/eurosat.py:141: in __init__
    self._verify()
_ _ _ _ _ _ _ _ _ _ _ _ _ _ _ _ _ _ _ _ _ _ _ _ _ _ _ _ _ _ _ _ _ _ _ _ _ _ _ _ 

self = <[AttributeError("'EuroSAT' object has no attribute 'imgs'") raised in repr()] EuroSAT object at 0x772ef4d4f890>

    def _verify(self) -> None:
        """Verify the integrity of the dataset."""
        # Check if the files already exist
        filepath = os.path.join(self.root, self.base_dir)
        if os.path.exists(filepath):
            return
    
        # Check if zip file already exists (if so then extract)
        if self._check_integrity():
            self._extract()
            return
    
        # Check if the user requested to download the dataset
        if not self.download:
>           raise DatasetNotFoundError(self)
E           torchgeo.datasets.errors.DatasetNotFoundError: Dataset not found in `root='tests/data/eurosat'` and `download=False`, either specify a different `root` or use `download=True` to automatically download the dataset.

/local/data0/moved_data/publishablew/torchgeo/torchgeo/torchgeo/datasets/eurosat.py:201: DatasetNotFoundError
=========================== short test summary info ============================
FAILED ../../../../../../local/data0/moved_data/publishablew/torchgeo/torchgeo/tests/models/test_rcf.py::TestRCF::test_empirical
========================= 1 failed, 6 passed in 1.35s ==========================


Initial Result:
============================= test session starts ==============================
platform linux -- Python 3.11.10, pytest-8.3.4, pluggy-1.5.0 -- /local/data0/moved_data/publishablew/torchgeo/torchgeo/venv/bin/python3
cachedir: .pytest_cache
rootdir: /local/data0/moved_data/publishablew/torchgeo/torchgeo
configfile: pyproject.toml
plugins: hydra-core-1.3.2
collecting ... collected 7 items

../../../../../../local/data0/moved_data/publishablew/torchgeo/torchgeo/tests/models/test_rcf.py::TestRCF::test_in_channels PASSED [ 14%]
../../../../../../local/data0/moved_data/publishablew/torchgeo/torchgeo/tests/models/test_rcf.py::TestRCF::test_num_features PASSED [ 28%]
../../../../../../local/data0/moved_data/publishablew/torchgeo/torchgeo/tests/models/test_rcf.py::TestRCF::test_untrainable PASSED [ 42%]
../../../../../../local/data0/moved_data/publishablew/torchgeo/torchgeo/tests/models/test_rcf.py::TestRCF::test_biases PASSED [ 57%]
../../../../../../local/data0/moved_data/publishablew/torchgeo/torchgeo/tests/models/test_rcf.py::TestRCF::test_seed PASSED [ 71%]
../../../../../../local/data0/moved_data/publishablew/torchgeo/torchgeo/tests/models/test_rcf.py::TestRCF::test_empirical FAILED [ 85%]
../../../../../../local/data0/moved_data/publishablew/torchgeo/torchgeo/tests/models/test_rcf.py::TestRCF::test_empirical_no_dataset PASSED [100%]

=================================== FAILURES ===================================
____________________________ TestRCF.test_empirical ____________________________

self = <tests.models.test_rcf.TestRCF object at 0x717999b2f990>

    def test_empirical(self) -> None:
        root = os.path.join('tests', 'data', 'eurosat')
>       ds = EuroSAT(root=root, bands=EuroSAT.rgb_bands, split='train')

/local/data0/moved_data/publishablew/torchgeo/torchgeo/tests/models/test_rcf.py:49: 
_ _ _ _ _ _ _ _ _ _ _ _ _ _ _ _ _ _ _ _ _ _ _ _ _ _ _ _ _ _ _ _ _ _ _ _ _ _ _ _ 
/local/data0/moved_data/publishablew/torchgeo/torchgeo/torchgeo/datasets/eurosat.py:141: in __init__
    self._verify()
_ _ _ _ _ _ _ _ _ _ _ _ _ _ _ _ _ _ _ _ _ _ _ _ _ _ _ _ _ _ _ _ _ _ _ _ _ _ _ _ 

self = <[AttributeError("'EuroSAT' object has no attribute 'imgs'") raised in repr()] EuroSAT object at 0x717999b4b310>

    def _verify(self) -> None:
        """Verify the integrity of the dataset."""
        # Check if the files already exist
        filepath = os.path.join(self.root, self.base_dir)
        if os.path.exists(filepath):
            return
    
        # Check if zip file already exists (if so then extract)
        if self._check_integrity():
            self._extract()
            return
    
        # Check if the user requested to download the dataset
        if not self.download:
>           raise DatasetNotFoundError(self)
E           torchgeo.datasets.errors.DatasetNotFoundError: Dataset not found in `root='tests/data/eurosat'` and `download=False`, either specify a different `root` or use `download=True` to automatically download the dataset.

/local/data0/moved_data/publishablew/torchgeo/torchgeo/torchgeo/datasets/eurosat.py:201: DatasetNotFoundError
=========================== short test summary info ============================
FAILED ../../../../../../local/data0/moved_data/publishablew/torchgeo/torchgeo/tests/models/test_rcf.py::TestRCF::test_empirical
========================= 1 failed, 6 passed in 1.36s ==========================
