output file:
processed_cleanlab_get_label_quality_per_image154.json
function:
_get_label_quality_per_image
Error Cases:

number of examples processed for estimating thresholds:   0%|          | 0/3 [00:00<?, ?it/s]
number of examples processed for estimating thresholds: 100%|██████████| 3/3 [00:00<00:00, 13751.82it/s]

number of examples processed for checking labels:   0%|          | 0/3 [00:00<?, ?it/s]
number of examples processed for checking labels: 100%|██████████| 3/3 [00:00<00:00, 41.66it/s]

number of examples processed for estimating thresholds:   0%|          | 0/3 [00:00<?, ?it/s]
number of examples processed for estimating thresholds: 100%|██████████| 3/3 [00:00<00:00, 14597.35it/s]

number of examples processed for checking labels:   0%|          | 0/3 [00:00<?, ?it/s]
number of examples processed for checking labels: 100%|██████████| 3/3 [00:00<00:00, 47.60it/s]

number of examples processed for estimating thresholds:   0%|          | 0/3 [00:00<?, ?it/s]
number of examples processed for estimating thresholds: 100%|██████████| 3/3 [00:00<00:00, 14496.44it/s]

number of examples processed for checking labels:   0%|          | 0/3 [00:00<?, ?it/s]
number of examples processed for checking labels: 100%|██████████| 3/3 [00:00<00:00, 52.66it/s]

number of examples processed for estimating thresholds:   0%|          | 0/3 [00:00<?, ?it/s]
number of examples processed for estimating thresholds: 100%|██████████| 3/3 [00:00<00:00, 12958.71it/s]

number of examples processed for checking labels:   0%|          | 0/3 [00:00<?, ?it/s]
number of examples processed for checking labels: 100%|██████████| 3/3 [00:00<00:00, 46.00it/s]

number of examples processed for estimating thresholds:   0%|          | 0/3 [00:00<?, ?it/s]
number of examples processed for estimating thresholds: 100%|██████████| 3/3 [00:00<00:00, 9853.49it/s]

number of examples processed for checking labels:   0%|          | 0/3 [00:00<?, ?it/s]
number of examples processed for checking labels: 100%|██████████| 3/3 [00:00<00:00, 24.70it/s]
number of examples processed for checking labels: 100%|██████████| 3/3 [00:00<00:00, 24.65it/s]

number of examples processed for estimating thresholds:   0%|          | 0/3 [00:00<?, ?it/s]
number of examples processed for estimating thresholds: 100%|██████████| 3/3 [00:00<00:00, 12264.05it/s]

number of examples processed for checking labels:   0%|          | 0/3 [00:00<?, ?it/s]
number of examples processed for checking labels: 100%|██████████| 3/3 [00:00<00:00, 122.78it/s]

number of examples processed for estimating thresholds:   0%|          | 0/100 [00:00<?, ?it/s]
number of examples processed for estimating thresholds: 100%|██████████| 100/100 [00:00<00:00, 16746.40it/s]

number of examples processed for checking labels:   0%|          | 0/100 [00:00<?, ?it/s]
number of examples processed for checking labels:   2%|▁         | 2/100 [00:00<00:05, 17.25it/s]
number of examples processed for checking labels:   4%|▁         | 4/100 [00:00<00:05, 17.32it/s]
number of examples processed for checking labels:   6%|▌         | 6/100 [00:00<00:05, 17.26it/s]
number of examples processed for checking labels:   8%|▊         | 8/100 [00:00<00:05, 17.24it/s]
number of examples processed for checking labels:  10%|█         | 10/100 [00:00<00:05, 17.23it/s]
number of examples processed for checking labels:  12%|█▁        | 12/100 [00:00<00:05, 17.19it/s]
number of examples processed for checking labels:  14%|█▁        | 14/100 [00:00<00:05, 17.08it/s]
number of examples processed for checking labels:  16%|█▌        | 16/100 [00:00<00:04, 17.17it/s]
number of examples processed for checking labels:  18%|█▊        | 18/100 [00:01<00:04, 17.19it/s]
number of examples processed for checking labels:  20%|██        | 20/100 [00:01<00:04, 17.24it/s]
number of examples processed for checking labels:  22%|██▁       | 22/100 [00:01<00:04, 17.20it/s]
number of examples processed for checking labels:  24%|██▁       | 24/100 [00:01<00:04, 17.23it/s]
number of examples processed for checking labels:  26%|██▌       | 26/100 [00:01<00:04, 17.25it/s]
number of examples processed for checking labels:  28%|██▊       | 28/100 [00:01<00:04, 17.25it/s]
number of examples processed for checking labels:  30%|███       | 30/100 [00:01<00:04, 17.20it/s]
number of examples processed for checking labels:  32%|███▁      | 32/100 [00:01<00:03, 17.13it/s]
number of examples processed for checking labels:  34%|███▁      | 34/100 [00:01<00:03, 17.13it/s]
number of examples processed for checking labels:  36%|███▌      | 36/100 [00:02<00:03, 17.16it/s]
number of examples processed for checking labels:  38%|███▊      | 38/100 [00:02<00:03, 17.19it/s]
number of examples processed for checking labels:  40%|████      | 40/100 [00:02<00:03, 17.10it/s]
number of examples processed for checking labels:  42%|████▁     | 42/100 [00:02<00:03, 17.09it/s]
number of examples processed for checking labels:  44%|████▁     | 44/100 [00:02<00:03, 17.12it/s]
number of examples processed for checking labels:  46%|████▌     | 46/100 [00:02<00:03, 17.19it/s]
number of examples processed for checking labels:  48%|████▊     | 48/100 [00:02<00:03, 17.17it/s]
number of examples processed for checking labels:  50%|█████     | 50/100 [00:02<00:02, 17.17it/s]
number of examples processed for checking labels:  52%|█████▁    | 52/100 [00:03<00:02, 17.15it/s]
number of examples processed for checking labels:  54%|█████▁    | 54/100 [00:03<00:02, 17.18it/s]
number of examples processed for checking labels:  56%|█████▌    | 56/100 [00:03<00:02, 17.17it/s]
number of examples processed for checking labels:  58%|█████▊    | 58/100 [00:03<00:02, 17.15it/s]
number of examples processed for checking labels:  60%|██████    | 60/100 [00:03<00:02, 17.18it/s]
number of examples processed for checking labels:  62%|██████▁   | 62/100 [00:03<00:02, 17.19it/s]
number of examples processed for checking labels:  64%|██████▁   | 64/100 [00:03<00:02, 17.20it/s]
number of examples processed for checking labels:  66%|██████▌   | 66/100 [00:03<00:01, 17.22it/s]
number of examples processed for checking labels:  68%|██████▊   | 68/100 [00:03<00:01, 17.20it/s]
number of examples processed for checking labels:  70%|███████   | 70/100 [00:04<00:01, 17.20it/s]
number of examples processed for checking labels:  72%|███████▁  | 72/100 [00:04<00:01, 17.19it/s]
number of examples processed for checking labels:  74%|███████▁  | 74/100 [00:04<00:01, 17.15it/s]
number of examples processed for checking labels:  76%|███████▌  | 76/100 [00:04<00:01, 17.19it/s]
number of examples processed for checking labels:  78%|███████▊  | 78/100 [00:04<00:01, 17.21it/s]
number of examples processed for checking labels:  80%|████████  | 80/100 [00:04<00:01, 17.11it/s]
number of examples processed for checking labels:  82%|████████▁ | 82/100 [00:04<00:01, 17.15it/s]
number of examples processed for checking labels:  84%|████████▁ | 84/100 [00:04<00:00, 17.16it/s]
number of examples processed for checking labels:  86%|████████▌ | 86/100 [00:05<00:00, 17.12it/s]
number of examples processed for checking labels:  88%|████████▊ | 88/100 [00:05<00:00, 17.08it/s]
number of examples processed for checking labels:  90%|█████████ | 90/100 [00:05<00:00, 17.12it/s]
number of examples processed for checking labels:  92%|█████████▁| 92/100 [00:05<00:00, 17.18it/s]
number of examples processed for checking labels:  94%|█████████▁| 94/100 [00:05<00:00, 17.18it/s]
number of examples processed for checking labels:  96%|█████████▌| 96/100 [00:05<00:00, 17.17it/s]
number of examples processed for checking labels:  98%|█████████▊| 98/100 [00:05<00:00, 16.81it/s]
number of examples processed for checking labels: 100%|██████████| 100/100 [00:05<00:00, 16.91it/s]
number of examples processed for checking labels: 100%|██████████| 100/100 [00:05<00:00, 17.15it/s]

number of examples processed for estimating thresholds:   0%|          | 0/100 [00:00<?, ?it/s]
number of examples processed for estimating thresholds: 100%|██████████| 100/100 [00:00<00:00, 16707.05it/s]

number of examples processed for checking labels:   0%|          | 0/100 [00:00<?, ?it/s]
number of examples processed for checking labels:   2%|▁         | 2/100 [00:00<00:05, 17.13it/s]
number of examples processed for checking labels:   4%|▁         | 4/100 [00:00<00:05, 17.19it/s]
number of examples processed for checking labels:   6%|▌         | 6/100 [00:00<00:05, 17.14it/s]
number of examples processed for checking labels:   8%|▊         | 8/100 [00:00<00:05, 17.02it/s]
number of examples processed for checking labels:  10%|█         | 10/100 [00:00<00:05, 16.95it/s]
number of examples processed for checking labels:  12%|█▁        | 12/100 [00:00<00:05, 17.02it/s]
number of examples processed for checking labels:  14%|█▁        | 14/100 [00:00<00:05, 17.10it/s]
number of examples processed for checking labels:  16%|█▌        | 16/100 [00:00<00:04, 17.06it/s]
number of examples processed for checking labels:  18%|█▊        | 18/100 [00:01<00:04, 17.09it/s]
number of examples processed for checking labels:  20%|██        | 20/100 [00:01<00:04, 17.14it/s]
number of examples processed for checking labels:  22%|██▁       | 22/100 [00:01<00:04, 17.13it/s]
number of examples processed for checking labels:  24%|██▁       | 24/100 [00:01<00:04, 17.15it/s]
number of examples processed for checking labels:  26%|██▌       | 26/100 [00:01<00:04, 17.20it/s]
number of examples processed for checking labels:  28%|██▊       | 28/100 [00:01<00:04, 17.13it/s]
number of examples processed for checking labels:  30%|███       | 30/100 [00:01<00:04, 17.15it/s]
number of examples processed for checking labels:  32%|███▁      | 32/100 [00:01<00:03, 17.07it/s]
number of examples processed for checking labels:  34%|███▁      | 34/100 [00:01<00:03, 17.08it/s]
number of examples processed for checking labels:  36%|███▌      | 36/100 [00:02<00:03, 17.13it/s]
number of examples processed for checking labels:  38%|███▊      | 38/100 [00:02<00:03, 17.21it/s]
number of examples processed for checking labels:  40%|████      | 40/100 [00:02<00:03, 17.24it/s]
number of examples processed for checking labels:  42%|████▁     | 42/100 [00:02<00:03, 17.23it/s]
number of examples processed for checking labels:  44%|████▁     | 44/100 [00:02<00:03, 17.17it/s]
number of examples processed for checking labels:  46%|████▌     | 46/100 [00:02<00:03, 17.16it/s]
number of examples processed for checking labels:  48%|████▊     | 48/100 [00:02<00:03, 17.17it/s]
number of examples processed for checking labels:  50%|█████     | 50/100 [00:02<00:02, 17.19it/s]
number of examples processed for checking labels:  52%|█████▁    | 52/100 [00:03<00:02, 17.15it/s]
number of examples processed for checking labels:  54%|█████▁    | 54/100 [00:03<00:02, 17.19it/s]
number of examples processed for checking labels:  56%|█████▌    | 56/100 [00:03<00:02, 17.18it/s]
number of examples processed for checking labels:  58%|█████▊    | 58/100 [00:03<00:02, 17.17it/s]
number of examples processed for checking labels:  60%|██████    | 60/100 [00:03<00:02, 17.18it/s]
number of examples processed for checking labels:  62%|██████▁   | 62/100 [00:03<00:02, 17.17it/s]
number of examples processed for checking labels:  64%|██████▁   | 64/100 [00:03<00:02, 17.15it/s]
number of examples processed for checking labels:  66%|██████▌   | 66/100 [00:03<00:01, 17.08it/s]
number of examples processed for checking labels:  68%|██████▊   | 68/100 [00:03<00:01, 17.08it/s]
number of examples processed for checking labels:  70%|███████   | 70/100 [00:04<00:01, 17.12it/s]
number of examples processed for checking labels:  72%|███████▁  | 72/100 [00:04<00:01, 17.16it/s]
number of examples processed for checking labels:  74%|███████▁  | 74/100 [00:04<00:01, 17.15it/s]
number of examples processed for checking labels:  76%|███████▌  | 76/100 [00:04<00:01, 17.13it/s]
number of examples processed for checking labels:  78%|███████▊  | 78/100 [00:04<00:01, 17.04it/s]
number of examples processed for checking labels:  80%|████████  | 80/100 [00:04<00:01, 17.03it/s]
number of examples processed for checking labels:  82%|████████▁ | 82/100 [00:04<00:01, 17.05it/s]
number of examples processed for checking labels:  84%|████████▁ | 84/100 [00:04<00:00, 17.07it/s]
number of examples processed for checking labels:  86%|████████▌ | 86/100 [00:05<00:00, 17.16it/s]
number of examples processed for checking labels:  88%|████████▊ | 88/100 [00:05<00:00, 17.21it/s]
number of examples processed for checking labels:  90%|█████████ | 90/100 [00:05<00:00, 17.13it/s]
number of examples processed for checking labels:  92%|█████████▁| 92/100 [00:05<00:00, 17.17it/s]
number of examples processed for checking labels:  94%|█████████▁| 94/100 [00:05<00:00, 17.17it/s]
number of examples processed for checking labels:  96%|█████████▌| 96/100 [00:05<00:00, 17.17it/s]
number of examples processed for checking labels:  98%|█████████▊| 98/100 [00:05<00:00, 17.18it/s]
number of examples processed for checking labels: 100%|██████████| 100/100 [00:05<00:00, 17.12it/s]
number of examples processed for checking labels: 100%|██████████| 100/100 [00:05<00:00, 17.13it/s]

number of examples processed for estimating thresholds:   0%|          | 0/100 [00:00<?, ?it/s]
number of examples processed for estimating thresholds: 100%|██████████| 100/100 [00:00<00:00, 30433.20it/s]

number of examples processed for checking labels:   0%|          | 0/100 [00:00<?, ?it/s]
number of examples processed for checking labels:   4%|▁         | 4/100 [00:00<00:02, 34.31it/s]
number of examples processed for checking labels:   8%|▊         | 8/100 [00:00<00:02, 34.18it/s]
number of examples processed for checking labels:  12%|█▁        | 12/100 [00:00<00:02, 34.21it/s]
number of examples processed for checking labels:  16%|█▌        | 16/100 [00:00<00:02, 34.27it/s]
number of examples processed for checking labels:  20%|██        | 20/100 [00:00<00:02, 34.24it/s]
number of examples processed for checking labels:  24%|██▁       | 24/100 [00:00<00:02, 34.30it/s]
number of examples processed for checking labels:  28%|██▊       | 28/100 [00:00<00:02, 34.25it/s]
number of examples processed for checking labels:  32%|███▁      | 32/100 [00:00<00:01, 34.26it/s]
number of examples processed for checking labels:  36%|███▌      | 36/100 [00:01<00:01, 34.19it/s]
number of examples processed for checking labels:  40%|████      | 40/100 [00:01<00:01, 34.15it/s]
number of examples processed for checking labels:  44%|████▁     | 44/100 [00:01<00:01, 34.15it/s]
number of examples processed for checking labels:  48%|████▊     | 48/100 [00:01<00:01, 34.15it/s]
number of examples processed for checking labels:  52%|█████▁    | 52/100 [00:01<00:01, 34.17it/s]
number of examples processed for checking labels:  56%|█████▌    | 56/100 [00:01<00:01, 34.00it/s]
number of examples processed for checking labels:  60%|██████    | 60/100 [00:01<00:01, 34.01it/s]
number of examples processed for checking labels:  64%|██████▁   | 64/100 [00:01<00:01, 34.03it/s]
number of examples processed for checking labels:  68%|██████▊   | 68/100 [00:01<00:00, 34.05it/s]
number of examples processed for checking labels:  72%|███████▁  | 72/100 [00:02<00:00, 33.92it/s]
number of examples processed for checking labels:  76%|███████▌  | 76/100 [00:02<00:00, 34.03it/s]
number of examples processed for checking labels:  80%|████████  | 80/100 [00:02<00:00, 34.16it/s]
number of examples processed for checking labels:  84%|████████▁ | 84/100 [00:02<00:00, 34.14it/s]
number of examples processed for checking labels:  88%|████████▊ | 88/100 [00:02<00:00, 34.15it/s]
number of examples processed for checking labels:  92%|█████████▁| 92/100 [00:02<00:00, 34.06it/s]
number of examples processed for checking labels:  96%|█████████▌| 96/100 [00:02<00:00, 34.04it/s]
number of examples processed for checking labels: 100%|██████████| 100/100 [00:02<00:00, 34.03it/s]
number of examples processed for checking labels: 100%|██████████| 100/100 [00:02<00:00, 34.12it/s]

number of examples processed for estimating thresholds:   0%|          | 0/2 [00:00<?, ?it/s]
number of examples processed for estimating thresholds: 100%|██████████| 2/2 [00:00<00:00, 9521.69it/s]

number of examples processed for checking labels:   0%|          | 0/2 [00:00<?, ?it/s]
number of examples processed for checking labels: 100%|██████████| 2/2 [00:00<00:00, 32.72it/s]

number of examples processed for estimating thresholds:   0%|          | 0/2 [00:00<?, ?it/s]
number of examples processed for estimating thresholds: 100%|██████████| 2/2 [00:00<00:00, 7121.06it/s]

number of examples processed for checking labels:   0%|          | 0/2 [00:00<?, ?it/s]
number of examples processed for checking labels: 100%|██████████| 2/2 [00:00<00:00, 21.82it/s]

number of examples processed for estimating thresholds:   0%|          | 0/2 [00:00<?, ?it/s]
number of examples processed for estimating thresholds: 100%|██████████| 2/2 [00:00<00:00, 3053.73it/s]

number of examples processed for checking labels:   0%|          | 0/2 [00:00<?, ?it/s]
number of examples processed for checking labels:  50%|█████     | 1/2 [00:00<00:00,  6.58it/s]
number of examples processed for checking labels: 100%|██████████| 2/2 [00:00<00:00,  6.57it/s]
number of examples processed for checking labels: 100%|██████████| 2/2 [00:00<00:00,  6.57it/s]

number of examples processed for estimating thresholds:   0%|          | 0/2 [00:00<?, ?it/s]
number of examples processed for estimating thresholds: 100%|██████████| 2/2 [00:00<00:00, 9742.87it/s]

number of examples processed for checking labels:   0%|          | 0/2 [00:00<?, ?it/s]
number of examples processed for checking labels: 100%|██████████| 2/2 [00:00<00:00, 33.72it/s]

number of examples processed for estimating thresholds:   0%|          | 0/2 [00:00<?, ?it/s]
number of examples processed for estimating thresholds: 100%|██████████| 2/2 [00:00<00:00, 1590.56it/s]

number of examples processed for checking labels:   0%|          | 0/2 [00:00<?, ?it/s]
number of examples processed for checking labels:  50%|█████     | 1/2 [00:00<00:00,  3.27it/s]
number of examples processed for checking labels: 100%|██████████| 2/2 [00:00<00:00,  3.24it/s]
number of examples processed for checking labels: 100%|██████████| 2/2 [00:00<00:00,  3.24it/s]

number of examples processed for estimating thresholds:   0%|          | 0/2 [00:00<?, ?it/s]
number of examples processed for estimating thresholds: 100%|██████████| 2/2 [00:00<00:00, 7307.15it/s]

number of examples processed for checking labels:   0%|          | 0/2 [00:00<?, ?it/s]
number of examples processed for checking labels: 100%|██████████| 2/2 [00:00<00:00, 23.55it/s]

number of examples processed for estimating thresholds:   0%|          | 0/2 [00:00<?, ?it/s]
number of examples processed for estimating thresholds: 100%|██████████| 2/2 [00:00<00:00, 2281.99it/s]

number of examples processed for checking labels:   0%|          | 0/2 [00:00<?, ?it/s]
number of examples processed for checking labels:  50%|█████     | 1/2 [00:00<00:00,  5.29it/s]
number of examples processed for checking labels: 100%|██████████| 2/2 [00:00<00:00,  5.05it/s]
number of examples processed for checking labels: 100%|██████████| 2/2 [00:00<00:00,  5.08it/s]

images processed using softmin:   0%|          | 0/3 [00:00<?, ?it/s]
images processed using softmin: 100%|██████████| 3/3 [00:00<00:00, 104.81it/s]

images processed using invalid_method:   0%|          | 0/3 [00:00<?, ?it/s]

images processed using softmin:   0%|          | 0/2 [00:00<?, ?it/s][A
images processed using softmin: 100%|██████████| 2/2 [00:00<00:00, 23109.11it/s]


images processed using softmin:   0%|          | 0/2 [00:00<?, ?it/s][A
images processed using softmin: 100%|██████████| 2/2 [00:00<00:00, 22982.49it/s]


images processed using softmin:   0%|          | 0/2 [00:00<?, ?it/s][A
images processed using softmin: 100%|██████████| 2/2 [00:00<00:00, 26546.23it/s]


images processed using softmin:   0%|          | 0/2 [00:00<?, ?it/s][A
images processed using softmin: 100%|██████████| 2/2 [00:00<00:00, 17810.21it/s]


images processed using softmin:   0%|          | 0/2 [00:00<?, ?it/s][A
images processed using softmin: 100%|██████████| 2/2 [00:00<00:00, 25343.23it/s]


images processed using softmin:   0%|          | 0/2 [00:00<?, ?it/s][A
images processed using softmin: 100%|██████████| 2/2 [00:00<00:00, 22671.91it/s]


images processed using softmin:   0%|          | 0/2 [00:00<?, ?it/s][A
images processed using softmin: 100%|██████████| 2/2 [00:00<00:00, 23629.88it/s]


images processed using softmin:   0%|          | 0/3 [00:00<?, ?it/s][A
images processed using softmin: 100%|██████████| 3/3 [00:00<00:00, 34473.73it/s]

images processed using invalid_method:   0%|          | 0/3 [00:00<?, ?it/s]

images processed using softmin:   0%|          | 0/3 [00:00<?, ?it/s]
images processed using softmin: 100%|██████████| 3/3 [00:00<00:00, 32181.36it/s]

images processed using softmin:   0%|          | 0/3 [00:00<?, ?it/s]
images processed using softmin: 100%|██████████| 3/3 [00:00<00:00, 34007.87it/s]

images processed using softmin:   0%|          | 0/3 [00:00<?, ?it/s]
images processed using softmin: 100%|██████████| 3/3 [00:00<00:00, 33288.13it/s]

number of examples processed for estimating thresholds:   0%|          | 0/3 [00:00<?, ?it/s]
number of examples processed for estimating thresholds: 100%|██████████| 3/3 [00:00<00:00, 19448.09it/s]

number of examples processed for checking labels:   0%|          | 0/3 [00:00<?, ?it/s]
number of examples processed for checking labels: 100%|██████████| 3/3 [00:00<00:00, 44.44it/s]

images processed using softmin:   0%|          | 0/3 [00:00<?, ?it/s]
images processed using softmin: 100%|██████████| 3/3 [00:00<00:00, 27235.74it/s]

number of examples processed for estimating thresholds:   0%|          | 0/3 [00:00<?, ?it/s]
number of examples processed for estimating thresholds: 100%|██████████| 3/3 [00:00<00:00, 19909.67it/s]

number of examples processed for checking labels:   0%|          | 0/3 [00:00<?, ?it/s]
number of examples processed for checking labels: 100%|██████████| 3/3 [00:00<00:00, 40.91it/s]

number of examples processed for estimating thresholds:   0%|          | 0/3 [00:00<?, ?it/s]
number of examples processed for estimating thresholds: 100%|██████████| 3/3 [00:00<00:00, 15178.42it/s]

number of examples processed for checking labels:   0%|          | 0/3 [00:00<?, ?it/s]
number of examples processed for checking labels: 100%|██████████| 3/3 [00:00<00:00, 44.27it/s]

number of examples processed for estimating thresholds:   0%|          | 0/3 [00:00<?, ?it/s]
number of examples processed for estimating thresholds: 100%|██████████| 3/3 [00:00<00:00, 14138.10it/s]

number of examples processed for checking labels:   0%|          | 0/3 [00:00<?, ?it/s]
number of examples processed for checking labels: 100%|██████████| 3/3 [00:00<00:00, 43.04it/s]

number of examples processed for estimating thresholds:   0%|          | 0/2 [00:00<?, ?it/s]
number of examples processed for estimating thresholds: 100%|██████████| 2/2 [00:00<00:00, 2465.79it/s]

number of examples processed for checking labels:   0%|          | 0/2 [00:00<?, ?it/s]
number of examples processed for checking labels:  50%|█████     | 1/2 [00:00<00:00,  5.38it/s]
number of examples processed for checking labels: 100%|██████████| 2/2 [00:00<00:00,  5.10it/s]
number of examples processed for checking labels: 100%|██████████| 2/2 [00:00<00:00,  5.14it/s]

  0%|          | 0/2741 [00:00<?, ?it/s]
100%|██████████| 2741/2741 [00:00<00:00, 587279.69it/s]

number of examples processed for estimating thresholds:   0%|          | 0/2 [00:00<?, ?it/s]
number of examples processed for estimating thresholds: 100%|██████████| 2/2 [00:00<00:00, 6647.07it/s]

number of examples processed for checking labels:   0%|          | 0/2 [00:00<?, ?it/s]
number of examples processed for checking labels: 100%|██████████| 2/2 [00:00<00:00, 12.25it/s]
number of examples processed for checking labels: 100%|██████████| 2/2 [00:00<00:00, 12.24it/s]

  0%|          | 0/406 [00:00<?, ?it/s]
100%|██████████| 406/406 [00:00<00:00, 589030.59it/s]

number of examples processed for estimating thresholds:   0%|          | 0/2 [00:00<?, ?it/s]
number of examples processed for estimating thresholds: 100%|██████████| 2/2 [00:00<00:00, 11413.07it/s]

number of examples processed for checking labels:   0%|          | 0/2 [00:00<?, ?it/s]
number of examples processed for checking labels: 100%|██████████| 2/2 [00:00<00:00, 30.70it/s]

  0%|          | 0/66 [00:00<?, ?it/s]
100%|██████████| 66/66 [00:00<00:00, 481433.15it/s]

number of examples processed for estimating thresholds:   0%|          | 0/2 [00:00<?, ?it/s]
number of examples processed for estimating thresholds: 100%|██████████| 2/2 [00:00<00:00, 4510.00it/s]

number of examples processed for checking labels:   0%|          | 0/2 [00:00<?, ?it/s]
number of examples processed for checking labels:  50%|█████     | 1/2 [00:00<00:00,  9.17it/s]
number of examples processed for checking labels: 100%|██████████| 2/2 [00:00<00:00,  8.98it/s]
number of examples processed for checking labels: 100%|██████████| 2/2 [00:00<00:00,  9.00it/s]

  0%|          | 0/1070 [00:00<?, ?it/s]
100%|██████████| 1070/1070 [00:00<00:00, 592384.54it/s]

number of examples processed for estimating thresholds:   0%|          | 0/2 [00:00<?, ?it/s]
number of examples processed for estimating thresholds: 100%|██████████| 2/2 [00:00<00:00, 3460.65it/s]

number of examples processed for checking labels:   0%|          | 0/2 [00:00<?, ?it/s]
number of examples processed for checking labels:  50%|█████     | 1/2 [00:00<00:00,  6.87it/s]
number of examples processed for checking labels: 100%|██████████| 2/2 [00:00<00:00,  7.16it/s]
number of examples processed for checking labels: 100%|██████████| 2/2 [00:00<00:00,  7.11it/s]

  0%|          | 0/1638 [00:00<?, ?it/s]
100%|██████████| 1638/1638 [00:00<00:00, 610148.31it/s]

Pass or Failed: 0

Related Failed Test Cases:
{'FAILED ../../../../../../local/data0/moved_data/publishablew/cleanlab/cleanlab/tests/test_segmentation.py::test_get_label_quality_scores', '../../../../../../local/data0/moved_data/publishablew/cleanlab/cleanlab/tests/test_segmentation.py::test_get_label_quality_scores FAILED', '../../../../../../local/data0/moved_data/publishablew/cleanlab/cleanlab/tests/test_segmentation.py::test_issues_from_scores FAILED', '../../../../../../local/data0/moved_data/publishablew/cleanlab/cleanlab/tests/test_segmentation.py::test_get_label_quality_scores_exceptions[method] FAILED', 'FAILED ../../../../../../local/data0/moved_data/publishablew/cleanlab/cleanlab/tests/test_segmentation.py::test_get_label_quality_scores_exceptions[method]', 'FAILED ../../../../../../local/data0/moved_data/publishablew/cleanlab/cleanlab/tests/test_segmentation.py::test__get_label_quality_per_image', '../../../../../../local/data0/moved_data/publishablew/cleanlab/cleanlab/tests/test_segmentation.py::test__get_label_quality_per_image FAILED', 'FAILED ../../../../../../local/data0/moved_data/publishablew/cleanlab/cleanlab/tests/test_segmentation.py::test_issues_from_scores'}

All Test Cases On Generated code:
============================= test session starts ==============================
platform linux -- Python 3.11.10, pytest-8.3.4, pluggy-1.5.0 -- /local/data0/moved_data/publishablew/cleanlab/cleanlab/venv/bin/python
cachedir: .pytest_cache
hypothesis profile 'default' -> database=DirectoryBasedExampleDatabase(PosixPath('/home/aliredaq/Desktop/ICSE/src/tester/.hypothesis/examples'))
rootdir: /local/data0/moved_data/publishablew/cleanlab/cleanlab
configfile: pyproject.toml
plugins: hypothesis-6.124.1
collecting ... collected 25 items

../../../../../../local/data0/moved_data/publishablew/cleanlab/cleanlab/tests/test_segmentation.py::test_find_label_issues Multiprocessing will default to using the number of logical cores (16). To default to number of physical cores: pip install psutil
Total number of examples whose labels have been evaluated: 300
Multiprocessing will default to using the number of logical cores (16). To default to number of physical cores: pip install psutil
Total number of examples whose labels have been evaluated: 75
Multiprocessing will default to using the number of logical cores (16). To default to number of physical cores: pip install psutil
Total number of examples whose labels have been evaluated: 12
Multiprocessing will default to using the number of logical cores (16). To default to number of physical cores: pip install psutil
Total number of examples whose labels have been evaluated: 300
Multiprocessing will default to using the number of logical cores (16). To default to number of physical cores: pip install psutil
Total number of examples whose labels have been evaluated: 300
Total number of examples whose labels have been evaluated: 300
PASSED
../../../../../../local/data0/moved_data/publishablew/cleanlab/cleanlab/tests/test_segmentation.py::test_results_are_consistent_with_batch_size Multiprocessing will default to using the number of logical cores (16). To default to number of physical cores: pip install psutil
Total number of examples whose labels have been evaluated: 2500
Multiprocessing will default to using the number of logical cores (16). To default to number of physical cores: pip install psutil
Total number of examples whose labels have been evaluated: 2500
Multiprocessing will default to using the number of logical cores (16). To default to number of physical cores: pip install psutil
Total number of examples whose labels have been evaluated: 2500
PASSED
../../../../../../local/data0/moved_data/publishablew/cleanlab/cleanlab/tests/test_segmentation.py::test_find_label_issues_sizes Multiprocessing will default to using the number of logical cores (16). To default to number of physical cores: pip install psutil
Total number of examples whose labels have been evaluated: 126
Multiprocessing will default to using the number of logical cores (16). To default to number of physical cores: pip install psutil
Total number of examples whose labels have been evaluated: 1222
Multiprocessing will default to using the number of logical cores (16). To default to number of physical cores: pip install psutil
Total number of examples whose labels have been evaluated: 6192
Multiprocessing will default to using the number of logical cores (16). To default to number of physical cores: pip install psutil
Total number of examples whose labels have been evaluated: 24
Multiprocessing will default to using the number of logical cores (16). To default to number of physical cores: pip install psutil
Total number of examples whose labels have been evaluated: 15714
Multiprocessing will default to using the number of logical cores (16). To default to number of physical cores: pip install psutil
Total number of examples whose labels have been evaluated: 1014
Multiprocessing will default to using the number of logical cores (16). To default to number of physical cores: pip install psutil
Total number of examples whose labels have been evaluated: 9512
PASSED
../../../../../../local/data0/moved_data/publishablew/cleanlab/cleanlab/tests/test_segmentation.py::test__check_input PASSED
../../../../../../local/data0/moved_data/publishablew/cleanlab/cleanlab/tests/test_segmentation.py::test_get_label_quality_scores FAILED
../../../../../../local/data0/moved_data/publishablew/cleanlab/cleanlab/tests/test_segmentation.py::test_get_label_quality_scores_exceptions[downsample] PASSED
../../../../../../local/data0/moved_data/publishablew/cleanlab/cleanlab/tests/test_segmentation.py::test_get_label_quality_scores_exceptions[method] FAILED
../../../../../../local/data0/moved_data/publishablew/cleanlab/cleanlab/tests/test_segmentation.py::test_get_label_quality_scores_exceptions[batch_size_negative] PASSED
../../../../../../local/data0/moved_data/publishablew/cleanlab/cleanlab/tests/test_segmentation.py::test_get_label_quality_scores_exceptions[batch_size_zero] PASSED
../../../../../../local/data0/moved_data/publishablew/cleanlab/cleanlab/tests/test_segmentation.py::test_get_label_quality_scores_sizes PASSED
../../../../../../local/data0/moved_data/publishablew/cleanlab/cleanlab/tests/test_segmentation.py::test_issues_from_scores FAILED
../../../../../../local/data0/moved_data/publishablew/cleanlab/cleanlab/tests/test_segmentation.py::test_issues_from_scores_no_pixel_scores PASSED
../../../../../../local/data0/moved_data/publishablew/cleanlab/cleanlab/tests/test_segmentation.py::test_issues_from_scores_various_thresholds PASSED
../../../../../../local/data0/moved_data/publishablew/cleanlab/cleanlab/tests/test_segmentation.py::test_issues_from_scores_invalid_inputs PASSED
../../../../../../local/data0/moved_data/publishablew/cleanlab/cleanlab/tests/test_segmentation.py::test_issues_from_scores_different_input_sizes PASSED
../../../../../../local/data0/moved_data/publishablew/cleanlab/cleanlab/tests/test_segmentation.py::test_issues_from_scores_sorting PASSED
../../../../../../local/data0/moved_data/publishablew/cleanlab/cleanlab/tests/test_segmentation.py::test__get_label_quality_per_image FAILED
../../../../../../local/data0/moved_data/publishablew/cleanlab/cleanlab/tests/test_segmentation.py::test_generate_color_map PASSED
../../../../../../local/data0/moved_data/publishablew/cleanlab/cleanlab/tests/test_segmentation.py::test_display_issues Multiprocessing will default to using the number of logical cores (16). To default to number of physical cores: pip install psutil
Total number of examples whose labels have been evaluated: 300
PASSED
../../../../../../local/data0/moved_data/publishablew/cleanlab/cleanlab/tests/test_segmentation.py::test_display_issues_figure Multiprocessing will default to using the number of logical cores (16). To default to number of physical cores: pip install psutil
Total number of examples whose labels have been evaluated: 300
PASSED
../../../../../../local/data0/moved_data/publishablew/cleanlab/cleanlab/tests/test_segmentation.py::test_display_issues_show Multiprocessing will default to using the number of logical cores (16). To default to number of physical cores: pip install psutil
Total number of examples whose labels have been evaluated: 300
PASSED
../../../../../../local/data0/moved_data/publishablew/cleanlab/cleanlab/tests/test_segmentation.py::test_common_label_issues PASSED
../../../../../../local/data0/moved_data/publishablew/cleanlab/cleanlab/tests/test_segmentation.py::test_filter_by_class Multiprocessing will default to using the number of logical cores (16). To default to number of physical cores: pip install psutil
Total number of examples whose labels have been evaluated: 300
PASSED
../../../../../../local/data0/moved_data/publishablew/cleanlab/cleanlab/tests/test_segmentation.py::test_summary_sizes Multiprocessing will default to using the number of logical cores (16). To default to number of physical cores: pip install psutil
Total number of examples whose labels have been evaluated: 8968
Class '0' is potentially mislabeled as class for '1' 1411 pixels in the dataset
Class '1' is potentially mislabeled as class for '0' 1330 pixels in the dataset
Multiprocessing will default to using the number of logical cores (16). To default to number of physical cores: pip install psutil
Total number of examples whose labels have been evaluated: 1326
Class '0' is potentially mislabeled as class for '1' 209 pixels in the dataset
Class '1' is potentially mislabeled as class for '0' 197 pixels in the dataset
Multiprocessing will default to using the number of logical cores (16). To default to number of physical cores: pip install psutil
Total number of examples whose labels have been evaluated: 190
Class '0' is potentially mislabeled as class for '1' 36 pixels in the dataset
Class '1' is potentially mislabeled as class for '0' 30 pixels in the dataset
Multiprocessing will default to using the number of logical cores (16). To default to number of physical cores: pip install psutil
Total number of examples whose labels have been evaluated: 3528
Class '0' is potentially mislabeled as class for '1' 562 pixels in the dataset
Class '1' is potentially mislabeled as class for '0' 508 pixels in the dataset
Multiprocessing will default to using the number of logical cores (16). To default to number of physical cores: pip install psutil
Total number of examples whose labels have been evaluated: 5368
Class '1' is potentially mislabeled as class for '0' 837 pixels in the dataset
Class '0' is potentially mislabeled as class for '1' 801 pixels in the dataset
PASSED
../../../../../../local/data0/moved_data/publishablew/cleanlab/cleanlab/tests/test_segmentation.py::test_get_valid_functions PASSED

=================================== FAILURES ===================================
________________________ test_get_label_quality_scores _________________________

    @pytest.mark.filterwarnings("ignore::UserWarning")  # Should be 1 warning
    def test_get_label_quality_scores():
        image_scores_softmin, pixel_scores = get_label_quality_scores(
            labels, pred_probs, method="softmin"
        )
>       assert np.argmax(error) == np.argmin(image_scores_softmin)
E       assert 1 == 0
E        +  where 1 = <function argmax at 0x7dea4918bb70>([0, 1, 0])
E        +    where <function argmax at 0x7dea4918bb70> = np.argmax
E        +  and   0 = <function argmin at 0x7dea4918bdf0>(array([0.10417324, 0.42512741, 0.10417324]))
E        +    where <function argmin at 0x7dea4918bdf0> = np.argmin

/local/data0/moved_data/publishablew/cleanlab/cleanlab/tests/test_segmentation.py:204: AssertionError
_______________ test_get_label_quality_scores_exceptions[method] _______________

method = 'invalid_method', downsample = None, batch_size = None
expected_exception = <class 'Exception'>
expected_message = "Invalid Method: Specify correct method. Currently only supports 'softmin'"

    @pytest.mark.parametrize(
        "method, downsample, batch_size, expected_exception, expected_message",
        [
            (
                "num_pixel_issues",
                4,
                None,
                Exception,
                "Height 10 and width 10 not divisible by downsample value of 4. Set kwarg downsample to 1 to avoid downsampling.",
            ),
            (
                "invalid_method",
                None,
                None,
                Exception,
                "Invalid Method: Specify correct method. Currently only supports 'softmin'",
            ),
            ("num_pixel_issues", 1, -1, ValueError, "Batch size must be greater than 0, got -1"),
            ("num_pixel_issues", 1, 0, ValueError, "Batch size must be greater than 0, got 0"),
        ],
        ids=["downsample", "method", "batch_size_negative", "batch_size_zero"],
    )
    def test_get_label_quality_scores_exceptions(
        method, downsample, batch_size, expected_exception, expected_message
    ):
        args = {"labels": labels, "pred_probs": pred_probs, "method": method}
        if downsample is not None:
            args["downsample"] = downsample
        if batch_size is not None:
            args["batch_size"] = batch_size
    
        with pytest.raises(expected_exception) as exc_info:
            get_label_quality_scores(**args)
    
>       assert expected_message in str(exc_info.value)
E       assert "Invalid Method: Specify correct method. Currently only supports 'softmin'" in "Unsupported method. Currently, only 'softmin' is supported."
E        +  where "Unsupported method. Currently, only 'softmin' is supported." = str(Exception("Unsupported method. Currently, only 'softmin' is supported."))
E        +    where Exception("Unsupported method. Currently, only 'softmin' is supported.") = <ExceptionInfo Exception("Unsupported method. Currently, only 'softmin' is supported.") tblen=4>.value

/local/data0/moved_data/publishablew/cleanlab/cleanlab/tests/test_segmentation.py:252: AssertionError
___________________________ test_issues_from_scores ____________________________

    def test_issues_from_scores():
        image_scores_softmin, pixel_scores = get_label_quality_scores(
            labels, pred_probs, method="softmin"
        )
        issues_from_score = issues_from_scores(image_scores_softmin, pixel_scores, threshold=1)
        assert np.shape(issues_from_score) == np.shape(pixel_scores)
        assert h * w * num_images == issues_from_score.sum()
    
        issues_from_score = issues_from_scores(image_scores_softmin, pixel_scores, threshold=0)
        assert 0 == issues_from_score.sum()
    
        issues_from_score = issues_from_scores(image_scores_softmin, pixel_scores, threshold=0.5)
        assert np.argmax(error) == np.argmax(issues_from_score.sum((1, 2)))
    
        sort_by_score = issues_from_scores(image_scores_softmin, threshold=0.5)
>       assert error[sort_by_score[0]] == 1
E       assert 0 == 1

/local/data0/moved_data/publishablew/cleanlab/cleanlab/tests/test_segmentation.py:292: AssertionError
______________________ test__get_label_quality_per_image _______________________

    def test__get_label_quality_per_image():
        # Test when pixel_scores is a random list of 100 values, method is "softmin", and temperature is random
        random_score_array = np.random.random((100,))
        temp = random.random()
        score = _get_label_quality_per_image(random_score_array, method="softmin", temperature=temp)
    
        cleanlab_softmin = softmin(
            np.expand_dims(random_score_array, axis=0), axis=1, temperature=temp
        )[0]
>       assert cleanlab_softmin == score, "Expected cleanlab_softmin to be equal to score"
E       AssertionError: Expected cleanlab_softmin to be equal to score
E       assert 0.42442380452198836 == 0.40924667371814566

/local/data0/moved_data/publishablew/cleanlab/cleanlab/tests/test_segmentation.py:349: AssertionError
=============================== warnings summary ===============================
tests/test_segmentation.py::test_summary_sizes
  /local/data0/moved_data/publishablew/cleanlab/cleanlab/cleanlab/segmentation/summary.py:140: RuntimeWarning: More than 20 figures have been opened. Figures created through the pyplot interface (`matplotlib.pyplot.figure`) are retained until explicitly closed and may consume too much memory. (To control this warning, see the rcParam `figure.max_open_warning`). Consider using `matplotlib.pyplot.close()`.
    _, axes = plt.subplots(1, output_plots, figsize=(5 * output_plots, 5))

-- Docs: https://docs.pytest.org/en/stable/how-to/capture-warnings.html
=========================== short test summary info ============================
FAILED ../../../../../../local/data0/moved_data/publishablew/cleanlab/cleanlab/tests/test_segmentation.py::test_get_label_quality_scores
FAILED ../../../../../../local/data0/moved_data/publishablew/cleanlab/cleanlab/tests/test_segmentation.py::test_get_label_quality_scores_exceptions[method]
FAILED ../../../../../../local/data0/moved_data/publishablew/cleanlab/cleanlab/tests/test_segmentation.py::test_issues_from_scores
FAILED ../../../../../../local/data0/moved_data/publishablew/cleanlab/cleanlab/tests/test_segmentation.py::test__get_label_quality_per_image
=================== 4 failed, 21 passed, 1 warning in 19.46s ===================


Final Test Result:
============================= test session starts ==============================
platform linux -- Python 3.11.10, pytest-8.3.4, pluggy-1.5.0 -- /local/data0/moved_data/publishablew/cleanlab/cleanlab/venv/bin/python
cachedir: .pytest_cache
hypothesis profile 'default' -> database=DirectoryBasedExampleDatabase(PosixPath('/home/aliredaq/Desktop/ICSE/src/tester/.hypothesis/examples'))
rootdir: /local/data0/moved_data/publishablew/cleanlab/cleanlab
configfile: pyproject.toml
plugins: hypothesis-6.124.1
collecting ... collected 25 items

../../../../../../local/data0/moved_data/publishablew/cleanlab/cleanlab/tests/test_segmentation.py::test_find_label_issues Multiprocessing will default to using the number of logical cores (16). To default to number of physical cores: pip install psutil
Total number of examples whose labels have been evaluated: 300
Multiprocessing will default to using the number of logical cores (16). To default to number of physical cores: pip install psutil
Total number of examples whose labels have been evaluated: 75
Multiprocessing will default to using the number of logical cores (16). To default to number of physical cores: pip install psutil
Total number of examples whose labels have been evaluated: 12
Multiprocessing will default to using the number of logical cores (16). To default to number of physical cores: pip install psutil
Total number of examples whose labels have been evaluated: 300
Multiprocessing will default to using the number of logical cores (16). To default to number of physical cores: pip install psutil
Total number of examples whose labels have been evaluated: 300
Total number of examples whose labels have been evaluated: 300
PASSED
../../../../../../local/data0/moved_data/publishablew/cleanlab/cleanlab/tests/test_segmentation.py::test_results_are_consistent_with_batch_size Multiprocessing will default to using the number of logical cores (16). To default to number of physical cores: pip install psutil
Total number of examples whose labels have been evaluated: 2500
Multiprocessing will default to using the number of logical cores (16). To default to number of physical cores: pip install psutil
Total number of examples whose labels have been evaluated: 2500
Multiprocessing will default to using the number of logical cores (16). To default to number of physical cores: pip install psutil
Total number of examples whose labels have been evaluated: 2500
PASSED
../../../../../../local/data0/moved_data/publishablew/cleanlab/cleanlab/tests/test_segmentation.py::test_find_label_issues_sizes Multiprocessing will default to using the number of logical cores (16). To default to number of physical cores: pip install psutil
Total number of examples whose labels have been evaluated: 126
Multiprocessing will default to using the number of logical cores (16). To default to number of physical cores: pip install psutil
Total number of examples whose labels have been evaluated: 1222
Multiprocessing will default to using the number of logical cores (16). To default to number of physical cores: pip install psutil
Total number of examples whose labels have been evaluated: 6192
Multiprocessing will default to using the number of logical cores (16). To default to number of physical cores: pip install psutil
Total number of examples whose labels have been evaluated: 24
Multiprocessing will default to using the number of logical cores (16). To default to number of physical cores: pip install psutil
Total number of examples whose labels have been evaluated: 15714
Multiprocessing will default to using the number of logical cores (16). To default to number of physical cores: pip install psutil
Total number of examples whose labels have been evaluated: 1014
Multiprocessing will default to using the number of logical cores (16). To default to number of physical cores: pip install psutil
Total number of examples whose labels have been evaluated: 9512
PASSED
../../../../../../local/data0/moved_data/publishablew/cleanlab/cleanlab/tests/test_segmentation.py::test__check_input PASSED
../../../../../../local/data0/moved_data/publishablew/cleanlab/cleanlab/tests/test_segmentation.py::test_get_label_quality_scores Multiprocessing will default to using the number of logical cores (16). To default to number of physical cores: pip install psutil
Total number of examples whose labels have been evaluated: 300
PASSED
../../../../../../local/data0/moved_data/publishablew/cleanlab/cleanlab/tests/test_segmentation.py::test_get_label_quality_scores_exceptions[downsample] PASSED
../../../../../../local/data0/moved_data/publishablew/cleanlab/cleanlab/tests/test_segmentation.py::test_get_label_quality_scores_exceptions[method] PASSED
../../../../../../local/data0/moved_data/publishablew/cleanlab/cleanlab/tests/test_segmentation.py::test_get_label_quality_scores_exceptions[batch_size_negative] PASSED
../../../../../../local/data0/moved_data/publishablew/cleanlab/cleanlab/tests/test_segmentation.py::test_get_label_quality_scores_exceptions[batch_size_zero] PASSED
../../../../../../local/data0/moved_data/publishablew/cleanlab/cleanlab/tests/test_segmentation.py::test_get_label_quality_scores_sizes PASSED
../../../../../../local/data0/moved_data/publishablew/cleanlab/cleanlab/tests/test_segmentation.py::test_issues_from_scores PASSED
../../../../../../local/data0/moved_data/publishablew/cleanlab/cleanlab/tests/test_segmentation.py::test_issues_from_scores_no_pixel_scores PASSED
../../../../../../local/data0/moved_data/publishablew/cleanlab/cleanlab/tests/test_segmentation.py::test_issues_from_scores_various_thresholds PASSED
../../../../../../local/data0/moved_data/publishablew/cleanlab/cleanlab/tests/test_segmentation.py::test_issues_from_scores_invalid_inputs PASSED
../../../../../../local/data0/moved_data/publishablew/cleanlab/cleanlab/tests/test_segmentation.py::test_issues_from_scores_different_input_sizes PASSED
../../../../../../local/data0/moved_data/publishablew/cleanlab/cleanlab/tests/test_segmentation.py::test_issues_from_scores_sorting PASSED
../../../../../../local/data0/moved_data/publishablew/cleanlab/cleanlab/tests/test_segmentation.py::test__get_label_quality_per_image PASSED
../../../../../../local/data0/moved_data/publishablew/cleanlab/cleanlab/tests/test_segmentation.py::test_generate_color_map PASSED
../../../../../../local/data0/moved_data/publishablew/cleanlab/cleanlab/tests/test_segmentation.py::test_display_issues Multiprocessing will default to using the number of logical cores (16). To default to number of physical cores: pip install psutil
Total number of examples whose labels have been evaluated: 300
PASSED
../../../../../../local/data0/moved_data/publishablew/cleanlab/cleanlab/tests/test_segmentation.py::test_display_issues_figure Multiprocessing will default to using the number of logical cores (16). To default to number of physical cores: pip install psutil
Total number of examples whose labels have been evaluated: 300
PASSED
../../../../../../local/data0/moved_data/publishablew/cleanlab/cleanlab/tests/test_segmentation.py::test_display_issues_show Multiprocessing will default to using the number of logical cores (16). To default to number of physical cores: pip install psutil
Total number of examples whose labels have been evaluated: 300
PASSED
../../../../../../local/data0/moved_data/publishablew/cleanlab/cleanlab/tests/test_segmentation.py::test_common_label_issues PASSED
../../../../../../local/data0/moved_data/publishablew/cleanlab/cleanlab/tests/test_segmentation.py::test_filter_by_class Multiprocessing will default to using the number of logical cores (16). To default to number of physical cores: pip install psutil
Total number of examples whose labels have been evaluated: 300
PASSED
../../../../../../local/data0/moved_data/publishablew/cleanlab/cleanlab/tests/test_segmentation.py::test_summary_sizes Multiprocessing will default to using the number of logical cores (16). To default to number of physical cores: pip install psutil
Total number of examples whose labels have been evaluated: 8968
Class '0' is potentially mislabeled as class for '1' 1411 pixels in the dataset
Class '1' is potentially mislabeled as class for '0' 1330 pixels in the dataset
Multiprocessing will default to using the number of logical cores (16). To default to number of physical cores: pip install psutil
Total number of examples whose labels have been evaluated: 1326
Class '0' is potentially mislabeled as class for '1' 209 pixels in the dataset
Class '1' is potentially mislabeled as class for '0' 197 pixels in the dataset
Multiprocessing will default to using the number of logical cores (16). To default to number of physical cores: pip install psutil
Total number of examples whose labels have been evaluated: 190
Class '0' is potentially mislabeled as class for '1' 36 pixels in the dataset
Class '1' is potentially mislabeled as class for '0' 30 pixels in the dataset
Multiprocessing will default to using the number of logical cores (16). To default to number of physical cores: pip install psutil
Total number of examples whose labels have been evaluated: 3528
Class '0' is potentially mislabeled as class for '1' 562 pixels in the dataset
Class '1' is potentially mislabeled as class for '0' 508 pixels in the dataset
Multiprocessing will default to using the number of logical cores (16). To default to number of physical cores: pip install psutil
Total number of examples whose labels have been evaluated: 5368
Class '1' is potentially mislabeled as class for '0' 837 pixels in the dataset
Class '0' is potentially mislabeled as class for '1' 801 pixels in the dataset
PASSED
../../../../../../local/data0/moved_data/publishablew/cleanlab/cleanlab/tests/test_segmentation.py::test_get_valid_functions PASSED

=============================== warnings summary ===============================
tests/test_segmentation.py::test_summary_sizes
  /local/data0/moved_data/publishablew/cleanlab/cleanlab/cleanlab/segmentation/summary.py:140: RuntimeWarning: More than 20 figures have been opened. Figures created through the pyplot interface (`matplotlib.pyplot.figure`) are retained until explicitly closed and may consume too much memory. (To control this warning, see the rcParam `figure.max_open_warning`). Consider using `matplotlib.pyplot.close()`.
    _, axes = plt.subplots(1, output_plots, figsize=(5 * output_plots, 5))

-- Docs: https://docs.pytest.org/en/stable/how-to/capture-warnings.html
======================== 25 passed, 1 warning in 19.32s ========================


Initial Result:
============================= test session starts ==============================
platform linux -- Python 3.11.10, pytest-8.3.4, pluggy-1.5.0 -- /local/data0/moved_data/publishablew/cleanlab/cleanlab/venv/bin/python
cachedir: .pytest_cache
hypothesis profile 'default' -> database=DirectoryBasedExampleDatabase(PosixPath('/home/aliredaq/Desktop/ICSE/src/tester/.hypothesis/examples'))
rootdir: /local/data0/moved_data/publishablew/cleanlab/cleanlab
configfile: pyproject.toml
plugins: hypothesis-6.124.1
collecting ... collected 25 items

../../../../../../local/data0/moved_data/publishablew/cleanlab/cleanlab/tests/test_segmentation.py::test_find_label_issues Multiprocessing will default to using the number of logical cores (16). To default to number of physical cores: pip install psutil
Total number of examples whose labels have been evaluated: 300
Multiprocessing will default to using the number of logical cores (16). To default to number of physical cores: pip install psutil
Total number of examples whose labels have been evaluated: 75
Multiprocessing will default to using the number of logical cores (16). To default to number of physical cores: pip install psutil
Total number of examples whose labels have been evaluated: 12
Multiprocessing will default to using the number of logical cores (16). To default to number of physical cores: pip install psutil
Total number of examples whose labels have been evaluated: 300
Multiprocessing will default to using the number of logical cores (16). To default to number of physical cores: pip install psutil
Total number of examples whose labels have been evaluated: 300
Total number of examples whose labels have been evaluated: 300
PASSED
../../../../../../local/data0/moved_data/publishablew/cleanlab/cleanlab/tests/test_segmentation.py::test_results_are_consistent_with_batch_size Multiprocessing will default to using the number of logical cores (16). To default to number of physical cores: pip install psutil
Total number of examples whose labels have been evaluated: 2500
Multiprocessing will default to using the number of logical cores (16). To default to number of physical cores: pip install psutil
Total number of examples whose labels have been evaluated: 2500
Multiprocessing will default to using the number of logical cores (16). To default to number of physical cores: pip install psutil
Total number of examples whose labels have been evaluated: 2500
PASSED
../../../../../../local/data0/moved_data/publishablew/cleanlab/cleanlab/tests/test_segmentation.py::test_find_label_issues_sizes Multiprocessing will default to using the number of logical cores (16). To default to number of physical cores: pip install psutil
Total number of examples whose labels have been evaluated: 126
Multiprocessing will default to using the number of logical cores (16). To default to number of physical cores: pip install psutil
Total number of examples whose labels have been evaluated: 1222
Multiprocessing will default to using the number of logical cores (16). To default to number of physical cores: pip install psutil
Total number of examples whose labels have been evaluated: 6192
Multiprocessing will default to using the number of logical cores (16). To default to number of physical cores: pip install psutil
Total number of examples whose labels have been evaluated: 24
Multiprocessing will default to using the number of logical cores (16). To default to number of physical cores: pip install psutil
Total number of examples whose labels have been evaluated: 15714
Multiprocessing will default to using the number of logical cores (16). To default to number of physical cores: pip install psutil
Total number of examples whose labels have been evaluated: 1014
Multiprocessing will default to using the number of logical cores (16). To default to number of physical cores: pip install psutil
Total number of examples whose labels have been evaluated: 9512
PASSED
../../../../../../local/data0/moved_data/publishablew/cleanlab/cleanlab/tests/test_segmentation.py::test__check_input PASSED
../../../../../../local/data0/moved_data/publishablew/cleanlab/cleanlab/tests/test_segmentation.py::test_get_label_quality_scores Multiprocessing will default to using the number of logical cores (16). To default to number of physical cores: pip install psutil
Total number of examples whose labels have been evaluated: 300
PASSED
../../../../../../local/data0/moved_data/publishablew/cleanlab/cleanlab/tests/test_segmentation.py::test_get_label_quality_scores_exceptions[downsample] PASSED
../../../../../../local/data0/moved_data/publishablew/cleanlab/cleanlab/tests/test_segmentation.py::test_get_label_quality_scores_exceptions[method] PASSED
../../../../../../local/data0/moved_data/publishablew/cleanlab/cleanlab/tests/test_segmentation.py::test_get_label_quality_scores_exceptions[batch_size_negative] PASSED
../../../../../../local/data0/moved_data/publishablew/cleanlab/cleanlab/tests/test_segmentation.py::test_get_label_quality_scores_exceptions[batch_size_zero] PASSED
../../../../../../local/data0/moved_data/publishablew/cleanlab/cleanlab/tests/test_segmentation.py::test_get_label_quality_scores_sizes PASSED
../../../../../../local/data0/moved_data/publishablew/cleanlab/cleanlab/tests/test_segmentation.py::test_issues_from_scores PASSED
../../../../../../local/data0/moved_data/publishablew/cleanlab/cleanlab/tests/test_segmentation.py::test_issues_from_scores_no_pixel_scores PASSED
../../../../../../local/data0/moved_data/publishablew/cleanlab/cleanlab/tests/test_segmentation.py::test_issues_from_scores_various_thresholds PASSED
../../../../../../local/data0/moved_data/publishablew/cleanlab/cleanlab/tests/test_segmentation.py::test_issues_from_scores_invalid_inputs PASSED
../../../../../../local/data0/moved_data/publishablew/cleanlab/cleanlab/tests/test_segmentation.py::test_issues_from_scores_different_input_sizes PASSED
../../../../../../local/data0/moved_data/publishablew/cleanlab/cleanlab/tests/test_segmentation.py::test_issues_from_scores_sorting PASSED
../../../../../../local/data0/moved_data/publishablew/cleanlab/cleanlab/tests/test_segmentation.py::test__get_label_quality_per_image PASSED
../../../../../../local/data0/moved_data/publishablew/cleanlab/cleanlab/tests/test_segmentation.py::test_generate_color_map PASSED
../../../../../../local/data0/moved_data/publishablew/cleanlab/cleanlab/tests/test_segmentation.py::test_display_issues Multiprocessing will default to using the number of logical cores (16). To default to number of physical cores: pip install psutil
Total number of examples whose labels have been evaluated: 300
PASSED
../../../../../../local/data0/moved_data/publishablew/cleanlab/cleanlab/tests/test_segmentation.py::test_display_issues_figure Multiprocessing will default to using the number of logical cores (16). To default to number of physical cores: pip install psutil
Total number of examples whose labels have been evaluated: 300
PASSED
../../../../../../local/data0/moved_data/publishablew/cleanlab/cleanlab/tests/test_segmentation.py::test_display_issues_show Multiprocessing will default to using the number of logical cores (16). To default to number of physical cores: pip install psutil
Total number of examples whose labels have been evaluated: 300
PASSED
../../../../../../local/data0/moved_data/publishablew/cleanlab/cleanlab/tests/test_segmentation.py::test_common_label_issues PASSED
../../../../../../local/data0/moved_data/publishablew/cleanlab/cleanlab/tests/test_segmentation.py::test_filter_by_class Multiprocessing will default to using the number of logical cores (16). To default to number of physical cores: pip install psutil
Total number of examples whose labels have been evaluated: 300
PASSED
../../../../../../local/data0/moved_data/publishablew/cleanlab/cleanlab/tests/test_segmentation.py::test_summary_sizes Multiprocessing will default to using the number of logical cores (16). To default to number of physical cores: pip install psutil
Total number of examples whose labels have been evaluated: 8968
Class '0' is potentially mislabeled as class for '1' 1411 pixels in the dataset
Class '1' is potentially mislabeled as class for '0' 1330 pixels in the dataset
Multiprocessing will default to using the number of logical cores (16). To default to number of physical cores: pip install psutil
Total number of examples whose labels have been evaluated: 1326
Class '0' is potentially mislabeled as class for '1' 209 pixels in the dataset
Class '1' is potentially mislabeled as class for '0' 197 pixels in the dataset
Multiprocessing will default to using the number of logical cores (16). To default to number of physical cores: pip install psutil
Total number of examples whose labels have been evaluated: 190
Class '0' is potentially mislabeled as class for '1' 36 pixels in the dataset
Class '1' is potentially mislabeled as class for '0' 30 pixels in the dataset
Multiprocessing will default to using the number of logical cores (16). To default to number of physical cores: pip install psutil
Total number of examples whose labels have been evaluated: 3528
Class '0' is potentially mislabeled as class for '1' 562 pixels in the dataset
Class '1' is potentially mislabeled as class for '0' 508 pixels in the dataset
Multiprocessing will default to using the number of logical cores (16). To default to number of physical cores: pip install psutil
Total number of examples whose labels have been evaluated: 5368
Class '1' is potentially mislabeled as class for '0' 837 pixels in the dataset
Class '0' is potentially mislabeled as class for '1' 801 pixels in the dataset
PASSED
../../../../../../local/data0/moved_data/publishablew/cleanlab/cleanlab/tests/test_segmentation.py::test_get_valid_functions PASSED

=============================== warnings summary ===============================
tests/test_segmentation.py::test_summary_sizes
  /local/data0/moved_data/publishablew/cleanlab/cleanlab/cleanlab/segmentation/summary.py:140: RuntimeWarning: More than 20 figures have been opened. Figures created through the pyplot interface (`matplotlib.pyplot.figure`) are retained until explicitly closed and may consume too much memory. (To control this warning, see the rcParam `figure.max_open_warning`). Consider using `matplotlib.pyplot.close()`.
    _, axes = plt.subplots(1, output_plots, figsize=(5 * output_plots, 5))

-- Docs: https://docs.pytest.org/en/stable/how-to/capture-warnings.html
======================== 25 passed, 1 warning in 19.49s ========================
